excerpt,published_date,refresh_existing,scraped_at,tags,title,topics,url
The 14 available locations are estimated to be able to provide up to 2 gigatonnes of additional carbon-dioxide storage capacity.,2025-12-10,0,2026-02-16T16:01:11.451578+00:00,"North Sea Transition Authority,carbon capture and storage,decarbonization,Teesside,licensing round",NSTA Launches UK’s Second Carbon-Storage Licensing Round,"Carbon capture and storage,Decarbonization",https://jpt.spe.org/nsta-launches-uks-second-carbon-storage-licensing-round
"First oil is expected from Phase 1 of the project in 2028, with up to four more phases planned.",2025-12-10,0,2026-02-16T16:01:11.915642+00:00,"Falkland Islands,FID,field development,offshore,South America",Rockhopper Exploration and Navitas Petroleum Green-Light Sea Lion Project in Falkland Islands,"Field/project development,Onshore/Offshore Facilities,Floating production systems",https://jpt.spe.org/partners-greenlight-sea-lion-project-in-falkland-islands
"GeoMap Europe is the latest in a series of interactive global geothermal maps that combine large subsurface and surface data sets to highlight where geothermal resources and development opportunities are strongest for power, heat, cooling, and storage.",2025-11-20,0,2026-02-16T16:01:12.245995+00:00,"Europe,Project Innerspace,geothermal energy,data science,innovation",Project InnerSpace Launches GeoMap Europe,"Geothermal energy,Data & Analytics,Environment,R&D/innovation",https://jpt.spe.org/project-innerspace-launches-geomap-europe
Westwood Energy analysts suggest operators have an opportunity to secure rigs at lower rates for their 2027 drilling programs.,2025-11-21,0,2026-02-16T16:01:12.723772+00:00,"drilling rigs,semisubmersible,jackups,deepwater,exploration,FID,offshore,Westwood Global Energy Group",2026 Offshore Challenge: Softening Demand Puts the Brakes on Day Rates,"Drilling,Business/economics,Field/project development,Exploration/discoveries",https://jpt.spe.org/2026-offshore-challenge-softening-demand-puts-the-brakes-on-day-rates
"By resuming work on the Rovuma LNG project, ExxonMobil tees up a final investment decision expected in 2026 as East Africa’s LNG hub begins to take shape with three separate projects now in construction.",2025-11-21,0,2026-02-16T16:01:12.818601+00:00,"Rovuma LNG,ExxonMobil,Eni,TotalEnergies,Mozambique,Africa,floating LNG (FLNG)",ExxonMobil Lifts Force Majeure on Mozambique Megaproject,"Field/project development,LNG",https://jpt.spe.org/exxonmobil-lifts-force-majeure-on-mozambique-megaproject
"Of the total approved by ADNOC’s board, $50 billion will be invested in Canada under a framework agreement targeting projects in AI, energy, and mining.",2025-11-25,0,2026-02-16T16:01:13.385334+00:00,"ADNOC,UAE,Abu Dhabi,Canada,artificial intelligence",ADNOC Board Greenlights $150-Billion Investment,"Business/economics,Exploration/discoveries,Field/project development,Asset/portfolio management,Onshore/Offshore Facilities,Sustainability",https://jpt.spe.org/adnoc-board-greenlights-150-billion-investment
"Alaskan oil is entering a renaissance driven by a predicted 13% upswing in 2026 production, the largest since the 1980s, and a possible reboot of LNG exports to Asia from the Kenai Peninsula, supplied via pipeline from the North Slope.",2025-12-01,0,2026-02-16T16:01:13.742837+00:00,,"Alaska’s Crude Output Surges, Gas To Play Greater Role",,https://jpt.spe.org/alaskas-crude-output-surges-gas-to-play-greater-role-restricted
Technology developers expect the tight-oil industry to give lightweight proppants another look after the Permian Basin’s biggest operator becomes an adopter.,2025-12-01,0,2026-02-16T16:01:14.080414+00:00,,"Is ExxonMobil’s Proprietary Proppant a One-Off Advantage, or Can the Rest of the Unconventional Sector Follow?",,https://jpt.spe.org/is-exxonmobils-proprietary-proppant-a-one-off-advantage-or-can-the-rest-of-the-unconventional-sector-follow-restricted
A new tubing-conveyed tool combines wellbore cleanout with multi-tracer deployment for production diagnostics and reservoir monitoring.,2025-12-01,0,2026-02-16T16:01:14.521353+00:00,"case study,tracers,unconventional resources,well interference,Permian Basin,electrical submersible pumps,monitoring",Case Study: Expanding Flow Diagnostics With Tubing-Conveyed Payload-Deployment Tool for Solid Fluid Tracer Delivery and Wellbore Cleanout,"Production,Completions,Oilfield chemistry,Well intervention,Flow assurance",https://jpt.spe.org/case-study-expanding-flow-diagnostics-with-tubing-conveyed-payload-deployment-tool-for-solid-fluid-tracer-delivery-and-wellbore-cleanout
Data and impartial viewpoints can help de-risk exploration portfolios and keep resource estimates in check.,2025-12-01,0,2026-02-16T16:01:14.794982+00:00,,Optimism Trap: The Dangers of a ‘Can’t Miss’ Mindset,,https://jpt.spe.org/optimism-trap-the-dangers-of-a-cant-miss-mindset-restricted
Updates about global exploration and production activities and developments.,2025-12-01,0,2026-02-16T16:01:15.295955+00:00,"ExxonMobil,QatarEnergy,Talos Energy,Equinor,Petrobras,Chevron,SLB,PTTEP,Campos Basin,Egypt,Gabon,Brazil,Gulf of Mexico,Pakistan,Greece",E&P Notes: December 2025,"Field/project development,Production,Exploration/discoveries,Onshore/Offshore Facilities",https://jpt.spe.org/e-p-notes-december-2025
This paper compares various drainage strategies and well completion configurations on the installation of inflow control technology by considering energy efficiency.,2025-12-01,0,2026-02-16T16:01:15.649129+00:00,"inflow control devices,energy efficiency,completions",Autonomous Inflow Control Technology and Its Effect on Energy Efficiency,"Flow assurance,Completions",https://jpt.spe.org/autonomous-inflow-control-technology-and-its-effect-on-energy-efficiency
"Adura will become the UK North Sea’s largest independent producer by combining 12 key oil and gas assets, employing around 1,200 staff. It aims to produce more than 140,000 BOED in 2026.",2025-12-01,0,2026-02-16T16:01:16.070170+00:00,"Shell,Equinor,North Sea,Scotland",Adura Launches as the UK North Sea’s Largest Independent Producer,"Business/economics,Asset/portfolio management,Onshore/Offshore Facilities",https://jpt.spe.org/adura-launches-as-the-uk-north-seas-largest-independent-producer
"The decision keeps the effective tax rate on upstream projects at 78%, prompting new warnings that investments will continue to dwindle in the UK Continental Shelf.",2025-12-02,0,2026-02-16T16:01:16.487386+00:00,"UK,UK Continental Shelf,regulations,fiscal regimes,Harbour Energy,offshore,Offshore Energies UK",UK Government Keeps Oil and Gas Windfall Tax Until 2030; Trade Groups Warn of a Perilous Spiral,"Production,Onshore/Offshore Facilities,Management,Human resources",https://jpt.spe.org/uk-government-keeps-oil-and-gas-windfall-tax-until-2030-trade-groups-warn-of-a-perilous-spiral
