excerpt,published_date,refresh_existing,scraped_at,source,tags,title,topics,url
The agency also requests feedback related to interest in a possible minerals lease sale offshore Alaska.,2026-01-30,0,2026-03-29T14:35:57.287799+00:00,,"Alaska,Bureau of Ocean Energy Management,California,Gulf of Mexico,lease sale,US",BOEM Seeks Comment on Proposed California OCS Lease Sales,"Asset/portfolio management,Business/economics,Exploration/discoveries",https://jpt.spe.org/boem-seeks-comment-on-proposed-california-ocs-lease-sales
The new assessment also estimates 28.3 Tcf of technically recoverable gas in the Woodford and Barnett shales.,2026-01-15,0,2026-03-29T14:35:57.702657+00:00,,"Permian Basin,US Geological Survey,Diamondback Energy,ExxonMobil,Occidental Petroleum",USGS: Permian Secondary Shales Hold 1.6 Billion Barrels of Recoverable Oil,"Formation evaluation,Reservoir,Unconventional/complex reservoirs",https://jpt.spe.org/usgs-permian-secondary-shales-hold-1-6-billion-barrels-of-recoverable-oil
"For more than a century, LSU has shaped petroleum engineering education, but few assets showcase its impact like the PERTT Lab. With six deep test wells and rare reservoir-depth gas-injection capabilities, the facility is helping drive breakthroughs in well control, carbon-dioxide injection, and next-generation energy technologies.",2026-01-16,0,2026-03-29T14:35:58.074865+00:00,,"Louisiana,training,engineering education,continuing education",From Six Full‑Scale Test Wells to a New Carbon-Dioxide Research Well: How LSU’s PERTT Lab Advances Oilfield and CCS Technologies,"R&D/innovation,Data & Analytics,Well integrity/control,Cybersecurity,MPD/UBD,Offshore/subsea systems,Carbon capture and storage,Flow assurance,Onshore/Offshore Facilities",https://jpt.spe.org/from-six-full-scale-test-wells-to-a-new-co2-research-well-how-lsus-pertt-lab-advances-oilfield-and-ccs-technologies
The acquisition adds 2.1 Bcf/D of production and pipeline infrastructure in Texas and Louisiana.,2026-01-16,0,2026-03-29T14:35:58.426204+00:00,,"Mitsubishi,Haynesville,mergers and acquisitions,Cameron LNG",Mitsubishi Enters US Shale Gas With $7.2 Billion Purchase of Aethon Assets,"Business/economics,Unconventional/complex reservoirs",https://jpt.spe.org/mitsubishi-enters-us-shale-gas-with-7-2-billion-purchase-of-aethon-assets
"The vessel, ordered by Eni, is expected to double LNG production at Eni’s project offshore Mozambique to 7 mtpa when it goes online in 2028.",2026-01-16,0,2026-03-29T14:35:58.802284+00:00,,"Samsung Heavy Industries,Eni,Mozambique,Africa,floating LNG (FLNG),Coral FLNG",Samsung Launches Coral North FLNG Hull,"LNG,Offshore/subsea systems,Onshore/Offshore Facilities",https://jpt.spe.org/samsung-launches-coral-north-flng-hull
The North Sea Transition Authority has updated its UKCS Well Applications and Consents Guidance to include the process for applying for consent to drill carbon-storage wells.,2026-01-16,0,2026-03-29T14:35:59.155727+00:00,,"carbon capture and storage,North Sea Transition Authority,UK Continental Shelf,North Sea",NSTA Adds Carbon-Storage Wells to Consent Guidance,Carbon capture and storage,https://jpt.spe.org/nsta-adds-carbon-storage-wells-to-consent-guidance
The report says the capacity of renewables in the region is set to grow tenfold by 2040 as electricity demand and new sectors drive rapid solar and wind expansion.,2026-01-16,0,2026-03-29T14:35:59.617842+00:00,,"Middle East,North Africa,renewable energy,energy transition,solar power,wind power,DNV",DNV Report Highlights Growth of Solar and Wind Capacity in the Middle East,"Energy transition,Sustainability,HSE & Sustainability",https://jpt.spe.org/dnv-report-highlights-growth-of-solar-and-wind-capacity-in-the-middle-east
"The Career Advancement Network held its 16th semiannual Energy Professionals Hiring Event at SPE’s 2025 Annual Technical Conference and Exhibition, allowing participants to connect with employers, explore opportunities, and seek information about job opportunities in a rapidly evolving industry.",2026-01-19,0,2026-03-29T14:35:59.851516+00:00,,"career guidance,career development,career,SPE event,SPE News",Energy Professionals Hiring Event Marks New Chapter at ATCE,Human resources,https://jpt.spe.org/energy-professionals-hiring-event-marks-new-chapter-at-atce
Malampaya East discovery is estimated to hold 98 Bcf of gas and may help offset declines at the country’s only producing gas field.,2026-01-19,0,2026-03-29T14:36:00.242500+00:00,,"Philippines,offshore,natural gas,gas condensate,gas discovery,South China Sea,Asia Pacific,Southeast Asia",Philippines Reports ‘Major’ Gas Find Near Malampaya Field,"Exploration/discoveries,Onshore/Offshore Facilities,Production,Reservoir,Completions,Drilling",https://jpt.spe.org/philippines-reports-major-gas-find-near-malampaya-field
"The NLR has released its 2025 US Geothermal Market Report, documenting 4 years of industry growth and providing policymakers and stakeholders with an updated overview of the US geothermal market.",2026-01-21,0,2026-03-29T14:36:00.735469+00:00,,"geothermal energy,Fervo,US,Utah FORGE,enhanced geothermal system,energy mix,R&D",National Laboratory of the Rockies Releases Geothermal Market Report,"Geothermal energy,Business/economics,R&D/innovation",https://jpt.spe.org/national-laboratory-of-the-rockies-releases-geothermal-market-report
"The project, which is owned and run by Equinor offshore New York, is more than 60% complete.",2026-01-21,0,2026-03-29T14:36:01.126543+00:00,,"Equinor,wind power,Department of Interior",Court Lets Construction Resume on Equinor’s Empire Wind,Offshore wind,https://jpt.spe.org/court-lets-construction-resume-on-equinors-empire-wind
Damage to power distribution systems prompted precautionary shutdowns at two major oil fields.,2026-01-21,0,2026-03-29T14:36:01.566209+00:00,,"Kazakhstan,Tengiz field,Caspian,Chevron",Fire Forces Temporary Shutdown at Kazakhstan’s Tengiz Oil Field,"Production,HSE & Sustainability",https://jpt.spe.org/fire-forces-temporary-shutdown-at-kazakhstans-tengiz-oil-field
The US Energy Information Administration said it expects US crude oil production to stay close to 2025 levels in 2026 before dipping in 2027.,2026-01-22,0,2026-03-29T14:36:01.982013+00:00,,"US Energy Information Administration,US,Permian Basin,Alaska,Gulf of Mexico",EIA Predicts Near-Term US Production To Remain Near 2025 Levels,Production,https://jpt.spe.org/eia-predicts-near-term-us-production-to-remain-near-2025-levels
