source,company_name,title,url,excerpt,published_date,scraped_at
OilPrice,TAE Technologies,TAE and UKAEA Launch Joint Venture to Commercialize Advanced Fusion Beams,https://oilprice.com/Company-News/TAE-and-UKAEA-Launch-Joint-Venture-to-Commercialize-Advanced-Fusion-Beams.html,"TAE Technologies has entered a reciprocal investment partnership with the UK Atomic Energy Authority to launch TAE Beam UK, a new joint venture designed to industrialize one of…",2025-12-02,2026-03-18T15:05:38.462881+00:00
OilPrice,TPAO,Turkey Strikes Major Oil and Gas Deals With Pakistan for 2026 Launch,https://oilprice.com/Company-News/Turkey-Strikes-Major-Oil-and-Gas-Deals-With-Pakistan-for-2026-Launch.html,Turkey and Pakistan have taken a major step toward deepening their energy partnership after Turkey’s state oil company TPAO signed a series of hydrocarbon exploration…,2025-12-02,2026-03-18T15:05:38.463294+00:00
OilPrice,TotalEnergies,TotalEnergies Emerges as Frontrunner for Giant Namibian Oil Discovery,https://oilprice.com/Company-News/TotalEnergies-Emerges-as-Frontrunner-for-Giant-Namibian-Oil-Discovery.html,"TotalEnergies has emerged as the frontrunner to acquire a major stake in Galp Energia’s blockbuster oil discovery offshore Namibia, according to people familiar with the…",2025-12-02,2026-03-18T15:05:38.463803+00:00
OilPrice,TotalEnergies,TotalEnergies and Partners Advance Nebraska e-NG Project,https://oilprice.com/Company-News/TotalEnergies-and-Partners-Advance-Nebraska-e-NG-Project.html,"TotalEnergies, TES, and three Japanese gas companies have signed a development agreement for the Live Oak e-NG project in Nebraska, targeting commercial operations by 2030.…",2025-12-02,2026-03-18T15:05:38.464240+00:00
OilPrice,Vestas,Vestas Secures 660 MW Offshore Wind Order in EMEA,https://oilprice.com/Company-News/Vestas-Secures-660-MW-Offshore-Wind-Order-in-EMEA.html,"Vestas has secured a 660 megawatt offshore wind order in the EMEA region, the turbine manufacturer said Monday, marking one of its largest additions to the company’s fourth-quarter…",2025-12-02,2026-03-18T15:05:38.464690+00:00
OilPrice,"Shell, Equinor",Shell and Equinor Launch Adura as UK’s Largest North Sea Producer,https://oilprice.com/Company-News/Shell-and-Equinor-Launch-Adura-as-UKs-Largest-North-Sea-Producer.html,"Shell and Equinor have formally combined their UK offshore oil and gas operations to create Adura, a new 50:50 joint venture that instantly becomes the…",2025-12-01,2026-03-18T15:05:38.465113+00:00
OilPrice,Gunvor Group,Gunvor Management Takes Full Control in Buy-Out and Names New CEO,https://oilprice.com/Company-News/Gunvor-Management-Takes-Full-Control-in-Buy-Out-and-Names-New-CEO.html,"Gunvor Group has entered a new era after its management team secured full ownership of the company through a long-planned buy-out, ending Torbjörn Törnqvist’s tenure…",2025-12-01,2026-03-18T15:05:38.465561+00:00
