excerpt,published_date,refresh_existing,scraped_at,source,tags,title,topics,url
"Polaris Commercial has announced a strategic partnership with M.E.S.O., Inc., a leading provider of mobile equipment maintenance and repair services. This collaboration will provide Pro XD owners expanded access to expert service, minimizing downtime and maximizing productivity on the jobsite.",2025-08-12,0,2026-02-25T17:42:27.990832+00:00,worldoil,"U.S. Onshore,Industry Trends","Polaris Commercial and M.E.S.O., Inc. partner to expand service for Pro XD work UTVs",Company News,https://www.worldoil.com/company-news/2025/8/12/polaris-commercial-and-m-e-s-o-inc-partner-to-expand-service-for-pro-xd-work-utvs/
"Fulkrum has announced the successful launch of its Legal Intern Program, a new initiative developed in partnership with the University of Southampton Global Legal Clinic. The program offers two law students a five-week placement with Fulkrum’s internal legal and compliance teams.",2025-08-19,0,2026-02-25T17:42:28.334215+00:00,worldoil,"UK/UKCS,People",Fulkrum celebrates successful launch of Legal Intern Program,Company News,https://www.worldoil.com/company-news/2025/8/19/fulkrum-celebrates-successful-launch-of-legal-intern-program/
"Supporting workforce logistics for both multinational crew rotations and shore-based and corporate personnel, ATPI will provide comprehensive travel solutions to each operator to ensure safe and efficient transfer of crew to and from drilling sites and offshore rigs.",2025-08-19,0,2026-02-25T17:42:28.707128+00:00,worldoil,"U.S. Offshore,Drilling,People",ATPI lands contracts with two U.S. offshore drilling contractors,Company News,https://www.worldoil.com/company-news/2025/8/19/atpi-lands-contracts-with-two-u-s-offshore-drilling-contractors/
"Dutch emission-reduction technology innovator Value Maritime has appointed MIE Group Ltd as its new commercial agent in Cyprus, reinforcing its commitment to expanding across the Mediterranean region.",2025-10-22,0,2026-02-25T17:42:29.154882+00:00,worldoil,"Eastern Mediterranean,Cyprus",Value Maritime expands Mediterranean presence with appointment of commercial agent in Cyprus,Company News,https://www.worldoil.com/company-news/2025/10/22/value-maritime-expands-mediterranean-presence-with-appointment-of-commercial-agent-in-cyprus/
"ORLEN expands its Norwegian Continental Shelf footprint with new equity in Albuskjell and Vest Ekofisk, advancing the Ekofisk-area PPF project targeting first gas in 2028.",2026-02-23,0,2026-02-25T17:42:29.594937+00:00,worldoil,Norway/NCS,ORLEN builds 25-MMboe North Sea portfolio in Ekofisk Area,Offshore,https://www.worldoil.com/news/2026/2/23/orlen-builds-25-mmboe-north-sea-portfolio-in-ekofisk-area/
"SOCAR and Gran Tierra Energy sign a production sharing agreement for exploration and development of a Guba-Caspian onshore block in Azerbaijan, with Gran Tierra as 65% operator.",2026-02-23,0,2026-02-25T17:42:29.997348+00:00,worldoil,"Europe,Exploration,Far East","SOCAR, Gran Tierra to explore onshore block in Azerbaijan",,https://www.worldoil.com/news/2026/2/23/socar-gran-tierra-to-explore-onshore-block-in-azerbaijan/
"Pertamina and Halliburton sign an MOU to evaluate multi-stage hydraulic fracturing, acid stimulation and AI-driven drilling technologies aimed at revitalizing mature upstream fields in Indonesia.",2026-02-23,0,2026-02-25T17:42:30.487222+00:00,worldoil,"Indonesia,Hydraulic Fracturing","Pertamina, Halliburton target unconventional fracturing expansion in Indonesia",,https://www.worldoil.com/news/2026/2/23/pertamina-halliburton-target-unconventional-fracturing-expansion-in-indonesia/
"Ovintiv is directing nearly $2.3 billion in 2026 capital toward its Permian and Montney assets, targeting up to 275 net wells and increased oil output from its core North American basins.",2026-02-24,0,2026-02-25T17:42:30.779875+00:00,worldoil,"Permian Basin,Canada",Ovintiv doubles down on Permian and Montney in 2026 capital shift,,https://www.worldoil.com/news/2026/2/24/ovintiv-doubles-down-on-permian-and-montney-in-2026-capital-shift/
Murphy Oil has plugged the Caracal-1X exploration well as a dry hole offshore Côte d’Ivoire but plans to proceed with the Bubale-1X prospect in its three-well West Africa campaign.,2026-02-24,0,2026-02-25T17:42:30.948426+00:00,worldoil,"Exploration,West Africa",Murphy Oil’s offshore West Africa well comes up dry,Offshore,https://www.worldoil.com/news/2026/2/24/murphy-oil-s-offshore-west-africa-well-comes-up-dry/
"Technip Energies has secured a contract to advance the Coral Norte FLNG project offshore Mozambique, reinforcing the country’s second floating LNG development in the Rovuma basin.",2026-02-24,0,2026-02-25T17:42:31.247797+00:00,worldoil,"East Africa,LNG,Deepwater",Technip Energies wins Coral Norte FLNG contract offshore Mozambique,Offshore,https://www.worldoil.com/news/2026/2/24/technip-energies-wins-coral-norte-flng-contract-offshore-mozambique/
ExxonMobil says rapid production growth in Guyana is strengthening its hand in negotiations for the next generation of global oil projects as competition for reserves intensifies.,2026-02-24,0,2026-02-25T17:42:31.549686+00:00,worldoil,"Production,Guyana",Exxon leverages Guyana growth in global race for new oil resources,,https://www.worldoil.com/news/2026/2/24/exxon-leverages-guyana-growth-in-global-race-for-new-oil-resources/
"Shale giant Diamondback Energy says fears of a global oil glut are easing as demand remains resilient, even as the Permian producer tests deeper drilling zones.",2026-02-24,0,2026-02-25T17:42:31.751753+00:00,worldoil,"Permian Basin,Shale",Shale giant Diamondback says global oil glut fears are fading,,https://www.worldoil.com/news/2026/2/24/shale-giant-diamondback-says-global-oil-glut-fears-are-fading/
"Angola’s state oil company Sonangol is continuing preparations for a potential IPO, despite being removed from the country’s current privatization list. The listing remains a key part of Angola’s strategy to improve transparency and attract foreign investment.",2026-02-25,0,2026-02-25T17:42:32.130858+00:00,worldoil,"Angola,ESG/Investment",Angola’s Sonangol advances IPO plans despite privatization program delays,,https://www.worldoil.com/news/2026/2/25/angola-s-sonangol-advances-ipo-plans-despite-privatization-program-delays/
