excerpt,published_date,refresh_existing,scraped_at,source,tags,title,topics,url
"Polaris Commercial has announced a strategic partnership with M.E.S.O., Inc., a leading provider of mobile equipment maintenance and repair services. This collaboration will provide Pro XD owners expanded access to expert service, minimizing downtime and maximizing productivity on the jobsite.",2025-08-12,0,2026-03-06T15:57:10.219163+00:00,worldoil,"U.S. Onshore,Industry Trends","Polaris Commercial and M.E.S.O., Inc. partner to expand service for Pro XD work UTVs",Company News,https://www.worldoil.com/company-news/2025/8/12/polaris-commercial-and-m-e-s-o-inc-partner-to-expand-service-for-pro-xd-work-utvs/
"Fulkrum has announced the successful launch of its Legal Intern Program, a new initiative developed in partnership with the University of Southampton Global Legal Clinic. The program offers two law students a five-week placement with Fulkrum’s internal legal and compliance teams.",2025-08-19,0,2026-03-06T15:57:10.615686+00:00,worldoil,"UK/UKCS,People",Fulkrum celebrates successful launch of Legal Intern Program,Company News,https://www.worldoil.com/company-news/2025/8/19/fulkrum-celebrates-successful-launch-of-legal-intern-program/
"Supporting workforce logistics for both multinational crew rotations and shore-based and corporate personnel, ATPI will provide comprehensive travel solutions to each operator to ensure safe and efficient transfer of crew to and from drilling sites and offshore rigs.",2025-08-19,0,2026-03-06T15:57:10.838683+00:00,worldoil,"U.S. Offshore,Drilling,People",ATPI lands contracts with two U.S. offshore drilling contractors,Company News,https://www.worldoil.com/company-news/2025/8/19/atpi-lands-contracts-with-two-u-s-offshore-drilling-contractors/
"Dutch emission-reduction technology innovator Value Maritime has appointed MIE Group Ltd as its new commercial agent in Cyprus, reinforcing its commitment to expanding across the Mediterranean region.",2025-10-22,0,2026-03-06T15:57:11.253394+00:00,worldoil,"Eastern Mediterranean,Cyprus",Value Maritime expands Mediterranean presence with appointment of commercial agent in Cyprus,Company News,https://www.worldoil.com/company-news/2025/10/22/value-maritime-expands-mediterranean-presence-with-appointment-of-commercial-agent-in-cyprus/
"ZENRG Services has acquired assets of Versiv Solutions to expand natural gas capture, cross-compression and emissions-reduction services across the U.S. energy and utility sectors.",2026-03-04,0,2026-03-06T15:57:11.689471+00:00,worldoil,,"ZENRG Services acquires Versiv Solutions assets, expanding natural gas capture technology","Energy Transition,Company News",https://www.worldoil.com/company-news/2026/3/4/zenrg-services-acquires-versiv-solutions-assets-expanding-natural-gas-capture-technology/
"Fuel shortages and price spikes are spreading across Asia as disruptions in the Strait of Hormuz halt Middle East oil shipments, forcing refiners and governments to restrict fuel exports and consider strategic stockpile releases.",2026-03-05,0,2026-03-06T15:57:12.115093+00:00,worldoil,"East Asia,South Asia,Middle East",Asia oil crunch deepens as Middle East conflict disrupts fuel supplies,Industry & Analysis,https://www.worldoil.com/news/2026/3/5/asia-oil-crunch-deepens-as-middle-east-conflict-disrupts-fuel-supplies/
"Monumental Energy reported initial oil production from the Ngaere-1 workover well in New Zealand’s Taranaki basin after perforating a previously bypassed pay zone, with the well stabilizing near 120 bopd.",2026-03-05,0,2026-03-06T15:57:12.525236+00:00,worldoil,"Production,New Zealand",Ngaere-1 well delivers initial oil production in New Zealand’s Taranaki basin,,https://www.worldoil.com/news/2026/3/5/ngaere-1-well-delivers-initial-oil-production-in-new-zealand-s-taranaki-basin/
"Nigeria President Bola Tinubu met with Eni CEO Claudio Descalzi to discuss deepwater development projects, including the Zabazaba-Etan fields, following the conversion of OPL 245 into new development and exploration licenses.",2026-03-05,0,2026-03-06T15:57:12.887244+00:00,worldoil,"Deepwater,Exploration,West Africa",Eni expands Nigeria deepwater plans following OPL 245 license conversion,,https://www.worldoil.com/news/2026/3/5/eni-expands-nigeria-deepwater-plans-following-opl-245-license-conversion/
"The Independent Petroleum Association of America welcomed the Interior Department’s move to roll back the offshore financial assurance rule, saying the regulation would have imposed billions in additional costs on independent offshore oil and gas producers.",2026-03-05,0,2026-03-06T15:57:13.291319+00:00,worldoil,"North America,U.S. Offshore,Regulatory",IPAA applauds Interior plan to reverse offshore financial assurance rule,,https://www.worldoil.com/news/2026/3/5/ipaa-applauds-interior-plan-to-reverse-offshore-financial-assurance-rule/
ADNOC CEO Sultan Al Jaber met with Japan Prime Minister Sanae Takaichi to discuss energy security as tensions in the Strait of Hormuz threaten oil and LNG flows to Asian markets.,2026-03-05,0,2026-03-06T15:57:13.740660+00:00,worldoil,"Middle East,East Asia",ADNOC CEO meets Japan PM Takaichi as Strait of Hormuz tensions mount,Industry & Analysis,https://www.worldoil.com/news/2026/3/5/adnoc-ceo-meets-japan-pm-takaichi-as-strait-of-hormuz-tensions-mount/
"WTI crude rose above $81 per barrel, the highest in 20 months, as the escalating Iran conflict disrupts shipping through the Strait of Hormuz and raises fears of prolonged global oil supply shortages.",2026-03-05,0,2026-03-06T15:57:14.121777+00:00,worldoil,"Middle East,Iran,Oil and Gas Prices",WTI tops $81 amid Strait of Hormuz supply fears,,https://www.worldoil.com/news/2026/3/5/wti-tops-81-amid-strait-of-hormuz-supply-fears/
"Acteon has delivered the first MHU4400S hydraulic hammer system to Heerema Marine Contractors, supporting offshore foundation installation and pile-driving operations under a multi-million-pound supply agreement.",2026-03-05,0,2026-03-06T15:57:14.508543+00:00,worldoil,,Acteon delivers MHU4400S hammer for offshore foundation installation,Offshore,https://www.worldoil.com/news/2026/3/5/acteon-delivers-mhu4400s-hammer-for-offshore-foundation-installation/
"Hanwha Ocean has secured a fabrication contract from Chevron Mediterranean for expansion modules at the Leviathan offshore gas field in Israel, supporting increased production capacity.",2026-03-05,0,2026-03-06T15:57:14.901020+00:00,worldoil,Israel,Chevron selects Hanwha Ocean for Leviathan platform expansion modules,Offshore,https://www.worldoil.com/news/2026/3/5/chevron-selects-hanwha-ocean-for-leviathan-platform-expansion-modules/
"Worley has been awarded a services framework agreement by Tengizchevroil to provide engineering, project and construction support services across the company’s oil and gas operations in Kazakhstan.",2026-03-05,0,2026-03-06T15:57:15.162884+00:00,worldoil,Kazakhstan,Worley expands Kazakhstan work with Tengizchevroil services agreement,,https://www.worldoil.com/news/2026/3/5/worley-expands-kazakhstan-work-with-tengizchevroil-services-agreement/
